{
  "schemaVersion": 2,
  "id": "google-spectrum",
  "mode": "light",
  "palette": {
    "accent": "#4285F4",
    "secondary": "#EA4335",
    "success": "#34A853",
    "warning": "#FBBC04",
    "danger": "#D93025",
    "focusRing": "#1A73E8",
    "background": "#F8F9FA",
    "foreground": "#202124",
    "muted": "#5F6368",
    "surface": "rgba(255, 255, 255, 0.92)",
    "surfaceElevated": "#FFFFFF",
    "border": "rgba(32, 33, 36, 0.65)",
    "codeBackground": "rgba(241, 243, 244, 0.96)",
    "codeForeground": "#202124",
    "inputBackground": "#FFFFFF",
    "buttonBackground": "#1A73E8",
    "buttonForeground": "#FFFFFF"
  },
  "layout": {
    "focusX": 78,
    "focusY": 52,
    "overlayStrength": 0,
    "contentSide": "left"
  },
  "componentSchemaVersion": 2,
  "authoring": {
    "path": "assisted",
    "fallback": "adaptive",
    "source": "manual",
    "preset": "soft"
  },
  "coverage": {
    "target": "complete",
    "enabled": [
      "foundation",
      "buttons",
      "icons",
      "overlaysAndForms",
      "taskArtifacts",
      "feedback",
      "utilityRoutes"
    ],
    "customized": [],
    "generated": [
      "foundation",
      "buttons",
      "icons",
      "overlaysAndForms",
      "taskArtifacts",
      "feedback",
      "utilityRoutes"
    ]
  },
  "components": {
    "foundation": {
      "surface": "rgba(255, 255, 255, 0.92)",
      "surfaceElevated": "#FFFFFF",
      "border": "rgba(32, 33, 36, 0.65)",
      "focusRing": "#1A73E8"
    },
    "buttons": {
      "disabledOpacity": 0.48,
      "primaryBackground": "#1A73E8",
      "primaryForeground": "#FFFFFF",
      "secondaryBackground": "#FFFFFF",
      "secondaryForeground": "#202124",
      "hoverBackground": "rgba(66, 133, 244, 0.14)",
      "destructiveBackground": "#D93025",
      "destructiveForeground": "#FFFFFF"
    },
    "icons": {
      "foreground": "#202124",
      "muted": "#5F6368",
      "accent": "#4285F4",
      "danger": "#D93025",
      "containerBackground": "rgba(66, 133, 244, 0.13)"
    },
    "overlaysAndForms": {
      "background": "#FFFFFF",
      "foreground": "#202124",
      "muted": "#5F6368",
      "border": "rgba(32, 33, 36, 0.65)",
      "inputBackground": "#FFFFFF",
      "focusRing": "#1A73E8",
      "selectedBackground": "rgba(66, 133, 244, 0.14)"
    },
    "taskArtifacts": {
      "background": "rgba(255, 255, 255, 0.92)",
      "toolBackground": "#FFFFFF",
      "codeBackground": "rgba(241, 243, 244, 0.96)",
      "codeForeground": "#202124",
      "terminalBackground": "rgba(241, 243, 244, 0.96)",
      "diffAdded": "rgba(52, 168, 83, 0.2)",
      "diffRemoved": "rgba(217, 48, 37, 0.2)",
      "border": "rgba(32, 33, 36, 0.65)"
    },
    "feedback": {
      "success": "#34A853",
      "warning": "#FBBC04",
      "danger": "#D93025",
      "info": "#EA4335",
      "badgeBackground": "rgba(66, 133, 244, 0.14)",
      "loadingAccent": "#4285F4"
    },
    "utilityRoutes": {
      "background": "rgba(255, 255, 255, 0.92)",
      "foreground": "#202124",
      "muted": "#5F6368",
      "activeBackground": "rgba(66, 133, 244, 0.14)",
      "activeForeground": "#202124",
      "hoverBackground": "rgba(66, 133, 244, 0.09)",
      "border": "rgba(32, 33, 36, 0.65)"
    }
  }
}
